{
  "schemaVersion": 1,
  "projectId": "existing-mod",
  "builds": { "main": { "root": ".", "adapter": "gradle", "java": "jdk21" } },
  "targets": {
    "fabric-1.21.1": {
      "minecraft": "1.21.1", "loader": "fabric", "build": "main",
      "java": { "gradle": "jdk21", "toolchain": 21, "game": "jdk21" },
      "tasks": { "build": ["build"], "unit": ["test"] },
      "artifactManifest": "build/harness/fabric-1.21.1.json",
      "requiredSuites": ["unit"]
    }
  },
  "suites": {
    "unit": { "driver": "gradle", "task": "unit", "minTests": 1, "results": "build/test-results/test/TEST-your.package.LogicTest.xml" },
    "server-smoke": { "driver": "unsupported" },
    "server-persistence": { "driver": "unsupported", "requiredCapabilities": ["world-persistence"] },
    "client-smoke": { "driver": "unsupported" },
    "multiplayer": { "driver": "unsupported" }
  },
  "runtimes": {}
}
